{
  "schemaVersion": "1.0.0",
  "capturedAt": "2026-08-20T12:15:00Z",
  "baselineStart": "2026-08-20T11:50:00Z",
  "testRun": {
    "file": "evidence/load/raw/test-run.json",
    "sha256": "95b62714b261fc363dffd3898d76bf6bc591376a561fdedeacc2467f7f6b6ec1",
    "resourceId": "/subscriptions/00000000-0000-0000-0000-000000000000/resourceGroups/rg-mh-example/providers/Microsoft.LoadTestService/loadTests/lt-mh-example"
  },
  "scaleConfiguration": {
    "file": "evidence/load/raw/container-app.json",
    "sha256": "9abce355f033f9df3cb3b9300811b600e566af54849b176038a7adf16145ca87",
    "observedAt": "2026-08-20T11:49:00Z"
  },
  "replicas": {
    "file": "evidence/load/raw/replicas.json",
    "sha256": "09e41a93e1cabad762c868d598d38ac1a4dfea010a715c7844429a19dc8796eb",
    "resourceId": "/subscriptions/00000000-0000-0000-0000-000000000000/resourceGroups/rg-mh-example/providers/Microsoft.App/containerApps/ca-mh-example",
    "metricName": "Replicas",
    "aggregation": "Maximum",
    "interval": "PT1M",
    "start": "2026-08-20T11:50:00Z",
    "end": "2026-08-20T12:15:00Z",
    "revisionName": "ca-mh-example--release-000000000000"
  },
  "databaseSignal": {
    "file": "evidence/load/raw/database.json",
    "sha256": "af95edf674de305535a815bb76fdb493b5bf2e8ceaea3f6a7b909a3d5bfb577b",
    "resourceId": "/subscriptions/00000000-0000-0000-0000-000000000000/resourceGroups/rg-mh-example/providers/Microsoft.Sql/servers/sql-example/databases/catalog",
    "metricName": "app_cpu_billed",
    "aggregation": "Total",
    "interval": "PT1M",
    "start": "2026-08-20T11:50:00Z",
    "end": "2026-08-20T12:05:00Z"
  },
  "recovery": {
    "observedAt": "2026-08-20T12:15:00Z",
    "healthUrl": "https://ca-mh-example.example.swedencentral.azurecontainerapps.io/healthz",
    "healthStatus": 200,
    "readinessUrl": "https://ca-mh-example.example.swedencentral.azurecontainerapps.io/readyz",
    "readinessStatus": 200
  },
  "artifacts": {
    "configurationFile": "tests/load/load-test.yaml",
    "configurationSha256": "0000000000000000000000000000000000000000000000000000000000000000",
    "jmeterFile": "tests/load/catalog-load.jmx",
    "jmeterSha256": "0000000000000000000000000000000000000000000000000000000000000000"
  }
}
